{
  "fromDate":"2017-04-06",
  "toDate":"2017-07-04",
  "income":{
    "periodAmount":5000.99,
    "taxDeducted":5000.99,
    "rentARoom":{
      "rentsReceived":5000.99
    }
  },
  "expenses":{
    "premisesRunningCosts": 5000.99,
    "repairsAndMaintenance": 5000.99,
    "financialCosts": 5000.99,
    "professionalFees": 5000.99,
    "costOfServices": 5000.99,
    "other": 5000.99,
    "travelCosts": 5000.99,
    "rentARoom":{
      "amountClaimed":5000.99
    }
  }
}